{
  "$schema": "https://json-schema.org/draft/2020-12/schema",
  "$id": "phase_field.dielectric_tangent_si.input.v1",
  "type": "object",
  "properties": {
    "schema_version": {
      "type": "string",
      "const": "phase_field.tangent-input.v1"
    },
    "operation": {
      "type": "string",
      "const": "dielectric_tangent_si"
    },
    "units": {
      "type": "string",
      "const": "SI"
    },
    "model_profile": {
      "type": "string",
      "const": "synthetic_tetragonal_quartic_v1"
    },
    "dimension": {
      "type": "integer",
      "enum": [
        2,
        3
      ]
    },
    "cells": {
      "type": "array",
      "items": {
        "type": "integer",
        "minimum": 1,
        "maximum": 128
      },
      "minItems": 2,
      "maxItems": 3
    },
    "boundary_condition": {
      "type": "string",
      "const": "all_surface_voltage"
    },
    "initial_condition": {
      "type": "object",
      "properties": {
        "kind": {
          "type": "string",
          "enum": [
            "uniform",
            "wall_180",
            "wall_90xy",
            "wall_90xz"
          ]
        },
        "values": {
          "type": "array",
          "items": {
            "type": "object",
            "properties": {
              "value": {
                "type": "number"
              },
              "unit": {
                "type": "string",
                "minLength": 1
              },
              "source": {
                "type": "object",
                "properties": {
                  "kind": {
                    "type": "string",
                    "enum": [
                      "synthetic_test",
                      "manual"
                    ]
                  },
                  "reference": {
                    "type": "string",
                    "minLength": 1
                  }
                },
                "required": [
                  "kind",
                  "reference"
                ],
                "additionalProperties": false
              }
            },
            "required": [
              "value",
              "unit",
              "source"
            ],
            "additionalProperties": false
          },
          "minItems": 2,
          "maxItems": 3
        }
      },
      "required": [
        "kind"
      ],
      "additionalProperties": false
    },
    "wall_half_length": {
      "type": "object",
      "properties": {
        "value": {
          "type": "number"
        },
        "unit": {
          "type": "string",
          "minLength": 1
        },
        "source": {
          "type": "object",
          "properties": {
            "kind": {
              "type": "string",
              "enum": [
                "synthetic_test",
                "manual"
              ]
            },
            "reference": {
              "type": "string",
              "minLength": 1
            }
          },
          "required": [
            "kind",
            "reference"
          ],
          "additionalProperties": false
        }
      },
      "required": [
        "value",
        "unit",
        "source"
      ],
      "additionalProperties": false
    },
    "loading_path": {
      "type": "array",
      "items": {
        "type": "array",
        "items": {
          "type": "object",
          "properties": {
            "value": {
              "type": "number"
            },
            "unit": {
              "type": "string",
              "minLength": 1
            },
            "source": {
              "type": "object",
              "properties": {
                "kind": {
                  "type": "string",
                  "enum": [
                    "synthetic_test",
                    "manual"
                  ]
                },
                "reference": {
                  "type": "string",
                  "minLength": 1
                }
              },
              "required": [
                "kind",
                "reference"
              ],
              "additionalProperties": false
            }
          },
          "required": [
            "value",
            "unit",
            "source"
          ],
          "additionalProperties": false
        },
        "minItems": 2,
        "maxItems": 3
      },
      "minItems": 1,
      "maxItems": 100
    },
    "equilibrium_atol": {
      "type": "number",
      "maximum": 1e-08,
      "minimum": 0
    },
    "verification": {
      "type": "object",
      "properties": {
        "finite_difference": {
          "type": "boolean"
        },
        "analytical": {
          "type": "boolean"
        }
      },
      "required": [
        "finite_difference",
        "analytical"
      ],
      "additionalProperties": false
    },
    "output": {
      "type": "object",
      "properties": {
        "images": {
          "type": "boolean"
        }
      },
      "required": [
        "images"
      ],
      "additionalProperties": false
    },
    "source": {
      "type": "object",
      "properties": {
        "kind": {
          "type": "string",
          "enum": [
            "synthetic_test",
            "manual"
          ]
        },
        "reference": {
          "type": "string",
          "minLength": 1
        }
      },
      "required": [
        "kind",
        "reference"
      ],
      "additionalProperties": false
    },
    "reference_scales": {
      "type": "object",
      "properties": {
        "length": {
          "type": "object",
          "properties": {
            "value": {
              "type": "number"
            },
            "unit": {
              "type": "string",
              "minLength": 1
            },
            "source": {
              "type": "object",
              "properties": {
                "kind": {
                  "type": "string",
                  "enum": [
                    "synthetic_test",
                    "manual"
                  ]
                },
                "reference": {
                  "type": "string",
                  "minLength": 1
                }
              },
              "required": [
                "kind",
                "reference"
              ],
              "additionalProperties": false
            }
          },
          "required": [
            "value",
            "unit",
            "source"
          ],
          "additionalProperties": false
        },
        "polarization": {
          "type": "object",
          "properties": {
            "value": {
              "type": "number"
            },
            "unit": {
              "type": "string",
              "minLength": 1
            },
            "source": {
              "type": "object",
              "properties": {
                "kind": {
                  "type": "string",
                  "enum": [
                    "synthetic_test",
                    "manual"
                  ]
                },
                "reference": {
                  "type": "string",
                  "minLength": 1
                }
              },
              "required": [
                "kind",
                "reference"
              ],
              "additionalProperties": false
            }
          },
          "required": [
            "value",
            "unit",
            "source"
          ],
          "additionalProperties": false
        },
        "time": {
          "type": "object",
          "properties": {
            "value": {
              "type": "number"
            },
            "unit": {
              "type": "string",
              "minLength": 1
            },
            "source": {
              "type": "object",
              "properties": {
                "kind": {
                  "type": "string",
                  "enum": [
                    "synthetic_test",
                    "manual"
                  ]
                },
                "reference": {
                  "type": "string",
                  "minLength": 1
                }
              },
              "required": [
                "kind",
                "reference"
              ],
              "additionalProperties": false
            }
          },
          "required": [
            "value",
            "unit",
            "source"
          ],
          "additionalProperties": false
        },
        "energy_density": {
          "type": "object",
          "properties": {
            "value": {
              "type": "number"
            },
            "unit": {
              "type": "string",
              "minLength": 1
            },
            "source": {
              "type": "object",
              "properties": {
                "kind": {
                  "type": "string",
                  "enum": [
                    "synthetic_test",
                    "manual"
                  ]
                },
                "reference": {
                  "type": "string",
                  "minLength": 1
                }
              },
              "required": [
                "kind",
                "reference"
              ],
              "additionalProperties": false
            }
          },
          "required": [
            "value",
            "unit",
            "source"
          ],
          "additionalProperties": false
        }
      },
      "required": [
        "length",
        "polarization",
        "time",
        "energy_density"
      ],
      "additionalProperties": false
    },
    "reduced_parameters": {
      "type": "object",
      "properties": {
        "a": {
          "type": "object",
          "properties": {
            "value": {
              "type": "number"
            },
            "unit": {
              "type": "string",
              "minLength": 1
            },
            "source": {
              "type": "object",
              "properties": {
                "kind": {
                  "type": "string",
                  "enum": [
                    "synthetic_test",
                    "manual"
                  ]
                },
                "reference": {
                  "type": "string",
                  "minLength": 1
                }
              },
              "required": [
                "kind",
                "reference"
              ],
              "additionalProperties": false
            }
          },
          "required": [
            "value",
            "unit",
            "source"
          ],
          "additionalProperties": false
        },
        "b": {
          "type": "object",
          "properties": {
            "value": {
              "type": "number"
            },
            "unit": {
              "type": "string",
              "minLength": 1
            },
            "source": {
              "type": "object",
              "properties": {
                "kind": {
                  "type": "string",
                  "enum": [
                    "synthetic_test",
                    "manual"
                  ]
                },
                "reference": {
                  "type": "string",
                  "minLength": 1
                }
              },
              "required": [
                "kind",
                "reference"
              ],
              "additionalProperties": false
            }
          },
          "required": [
            "value",
            "unit",
            "source"
          ],
          "additionalProperties": false
        },
        "c": {
          "type": "object",
          "properties": {
            "value": {
              "type": "number"
            },
            "unit": {
              "type": "string",
              "minLength": 1
            },
            "source": {
              "type": "object",
              "properties": {
                "kind": {
                  "type": "string",
                  "enum": [
                    "synthetic_test",
                    "manual"
                  ]
                },
                "reference": {
                  "type": "string",
                  "minLength": 1
                }
              },
              "required": [
                "kind",
                "reference"
              ],
              "additionalProperties": false
            }
          },
          "required": [
            "value",
            "unit",
            "source"
          ],
          "additionalProperties": false
        }
      },
      "required": [
        "a",
        "b",
        "c"
      ],
      "additionalProperties": false
    },
    "g": {
      "type": "object",
      "properties": {
        "value": {
          "type": "number"
        },
        "unit": {
          "type": "string",
          "minLength": 1
        },
        "source": {
          "type": "object",
          "properties": {
            "kind": {
              "type": "string",
              "enum": [
                "synthetic_test",
                "manual"
              ]
            },
            "reference": {
              "type": "string",
              "minLength": 1
            }
          },
          "required": [
            "kind",
            "reference"
          ],
          "additionalProperties": false
        }
      },
      "required": [
        "value",
        "unit",
        "source"
      ],
      "additionalProperties": false
    },
    "epsilon": {
      "type": "object",
      "properties": {
        "value": {
          "type": "number"
        },
        "unit": {
          "type": "string",
          "minLength": 1
        },
        "source": {
          "type": "object",
          "properties": {
            "kind": {
              "type": "string",
              "enum": [
                "synthetic_test",
                "manual"
              ]
            },
            "reference": {
              "type": "string",
              "minLength": 1
            }
          },
          "required": [
            "kind",
            "reference"
          ],
          "additionalProperties": false
        }
      },
      "required": [
        "value",
        "unit",
        "source"
      ],
      "additionalProperties": false
    }
  },
  "required": [
    "schema_version",
    "operation",
    "units",
    "model_profile",
    "dimension",
    "cells",
    "boundary_condition",
    "initial_condition",
    "loading_path",
    "equilibrium_atol",
    "verification",
    "output",
    "source",
    "reference_scales",
    "reduced_parameters",
    "g",
    "epsilon"
  ],
  "additionalProperties": false
}
